{
  "$schema": "../../../../schemas/core/standards-section.schema.json",
  "clause_ref": "NFPA 70E:2024 §130.3",
  "section_title": "Other Precautions for Personnel Activities",
  "summary": "General precautions when working near energized parts that don't fall under specific §130.4 or §130.5 categories. Covers conductive clothing, alertness, communication, environmental conditions.",
  "key_decisions": [
    {"id": "no-conductive-clothing", "description": "Conductive articles (jewellery, watches, metallic frames) must be removed within shock-approach boundaries."},
    {"id": "alert-conditions",       "description": "Worker fatigue, drugs, illness, or alcohol prohibit energized work."},
    {"id": "communication-protocol", "description": "Job briefing required before energized work; standby person required for difficult tasks."},
    {"id": "environmental",          "description": "Wet conditions, poor visibility, confined spaces add to risk + may require additional PPE or de-energization."}
  ],
  "cross_references": ["NFPA 70E:2024 §130.7", "NFPA 70E:2024 §130.4"],
  "transcribed_at": "2026-05-17",
  "transcribed_by": "DraftsMan skills repo",
  "verification_status": "verified-against-source",
  "license_note": "Section structure summarised."
}
